Summary,Issue key,Issue id,Issue Type,Status,Project key,Project name,Project type,Project lead,Project lead id,Project description,Project url,Priority,Resolution,Assignee,Assignee Id,Reporter,Reporter Id,Creator,Creator Id,Created,Updated,Last Viewed,Resolved,Affects versions,Fix versions,Components,Components,Components,Components,Due date,Votes,Labels,Description,Environment,Watchers,Watchers,Watchers Id,Watchers Id,Original estimate,Remaining Estimate,Time Spent,Work Ratio,Σ Original Estimate,Σ Remaining Estimate,Σ Time Spent,Security Level,Inward issue link (Cloners),Outward issue link (Cloners),Inward issue link (Depends On),Outward issue link (Depends On),Inward issue link (Issue split),Outward issue link (Issue split),Outward issue link (Issue split),Inward issue link (Relates),Outward issue link (Relates),Outward issue link (Relates),Outward issue link (Relates),Inward issue link (Resolves),Outward issue link (Resolves),Inward issue link (Test),Inward issue link (Test),Inward issue link (Test),Inward issue link (Test),Inward issue link (Test),Inward issue link (Test),Inward issue link (Test),Inward issue link (Test),Outward issue link (Test),Outward issue link (Test),Outward issue link (Test),Outward issue link (Test),Outward issue link (Test),Outward issue link (Test),Outward issue link (Test),Outward issue link (Test),Outward issue link (Test),Outward issue link (Test),Attachment,Attachment,Attachment,Attachment,Attachment,Attachment,Attachment,Custom field (# Environments Impacted),Custom field (AI Advisory Review Complete Date),Custom field (AI Council Review Complete Date),Custom field (ARC ID),Custom field (Acceptance Criteria),Custom field (Accountable Team),Custom field (Actual Results),Custom field (Actual Value),Custom field (Additional Contacts),Custom field (Additional Contacts),Custom field (Additional Contacts),Custom field (Additional Contacts),Custom field (Additional Contacts)Id,Custom field (Additional Contacts)Id,Custom field (Additional Contacts)Id,Custom field (Additional Contacts)Id,Custom field (Affected services),Custom field (Age),Custom field (Agile Release Train),Custom field (Aha! Reference),Custom field (Align PI),Custom field (Align Parent Name),Custom field (Any JVM Restart Required?),Custom field (Application),Custom field (Application Hub),Custom field (Approvals),Custom field (Approver),Custom field (Architect),Custom field (Automated),Custom field (Automation),Custom field (BLOCKER),Custom field (BPM Deployment Changes),Custom field (Batch Handbook Update Required),Custom field (Batch Impact Detail),Custom field (Begin Date),Custom field (Board),Custom field (Build Command Changes),Custom field (Build Reproduced In),Custom field (Business Benefit),Custom field (Business Description),Custom field (Business Initiative Owner),Custom field (Business Need by Date),Custom field (Business Priority),Custom field (Business Service),Custom field (Business Value),Custom field (CSAA Code Override?),Custom field (CSAA JAR Replacement?),Custom field (Category),Custom field (Change Manager),Custom field (Change Risk),Custom field (Changes in JVM Heap Size),Custom field (Changes to JVM Arguments),Custom field (Checklists),Custom field (Client),Custom field (Clone to...),Custom field (Completed at Revision),Custom field (Configurable Item),Custom field (Consumer release),Custom field (Conversion Impact Detail),Custom field (Current State),Custom field (DB Changes - Yes/No),Custom field (Date In Progress),Custom field (Date Scheduled for Review),Custom field (Date in Analysis),Custom field (Date in Triage),Custom field (Date off Hold),Custom field (Date on Hold),Custom field (Deferral),Custom field (Delivered in Build),Custom field (Delta of Schema Changes),Custom field (Demand/Product Owner),Custom field (Department / Division),Custom field (Dependency),Custom field (Deployment Notes),Custom field (Desired Deployment Date),Custom field (Details on JVM Configurations),Custom field (Detected By),Custom field (Detected in Build),Custom field (Detected on),Custom field (Development),Custom field (Direct Demand),Custom field (End Date),Custom field (End Time),Custom field (Enterprise Program),Custom field (Environment (Dropdown)),Custom field (Environment Info),Custom field (Epic Color),Custom field (Epic Link),Epic Link Summary,Custom field (Epic Name),Custom field (Epic Status),Custom field (Epic Title),Custom field (Existing Production Data Impact Detail),Custom field (Expected Results),Custom field (External System ID),Custom field (External issue ID),Custom field (External issue ID),Custom field (External issue ID),Custom field (External issue ID),Custom field (Feature Flag),Custom field (Field instruction 1),Custom field (Field instruction 2),Custom field (Finance Lead),Custom field (Fixed by Group),Custom field (Fixed in Branch Revision),Custom field (Functional Area),Custom field (Goals),Custom field (IRR),Custom field (IT Owner),Custom field (Identified as PIR),Custom field (Impacted Product(s)),Custom field (Impacted Product(s)),Custom field (Impacted Product(s)),Custom field (Impacted State(s)),Custom field (Impacts),Custom field (Implementation SQL),Custom field (Implemented),Custom field (Incident Impact Hours),Custom field (Incident Open Date),Custom field (Information on Standalone Scripts),Custom field (Initiative Rank),Custom field (Initiative Type),Custom field (Intake File Completion Date),Custom field (Integrated Systems),Custom field (Interim Procedure),Custom field (Introduced by Release),Custom field (Issue color),Custom field (JDK Changes),Custom field (Jar Version),Custom field (Jira Project Name),Custom field (Linked Items),Custom field (Liquibase Deployment Changes),Custom field (Locked forms),Custom field (MQ Configuration Steps),Custom field (Major Customer Incident),Custom field (Market Size),Custom field (Maven Changes),Custom field (Minutes on Hold),Custom field (Mitigation Plan),Custom field (MoSCoW),Custom field (Module),Custom field (Module),Custom field (Name),Custom field (Net Recurring Benefit ($)),Custom field (New Directory Name),Custom field (Notes),Custom field (Notice of Outcome Complete Date),Custom field (One Time Cost ($)),Custom field (Online Impact Detail),Custom field (Open forms),Custom field (Other Changes),Custom field (Ownership),Custom field (PAS Release),Custom field (PI),Custom field (PIR#),Custom field (Parent Title),Custom field (People Dependency),Custom field (Planned Outage),Custom field (Policy Holder Impact),Custom field (Policy Impacted Count),Custom field (Preconditions),Custom field (Product Deployment Changes),Custom field (Program Manager),Custom field (Project Code),Custom field (Project Submission Date),Custom field (Project overview key),Custom field (Project overview status),Custom field (QA Drop Date),Custom field (Quality Improvement Category),Custom field (ROI),Custom field (Rally Creation Date),Custom field (Rally Original Estimate),Custom field (Rank),Custom field (Recurring Annual Benefit ($)),Custom field (Recurring Annual Cost ($)),Custom field (Regression),Custom field (Release Feature to Production?),Custom field (Release Notes),Custom field (Remaining Work),Custom field (Reopen Reason),Custom field (Reproducible In Future Build?),Custom field (Reproduction Steps),Custom field (Request Type),Custom field (Request language),Custom field (Request participants),Custom field (Requesting Group),Custom field (Requestor),Custom field (Requirement Analysis Time),Custom field (Resolution Description),Custom field (Resolution Time),Custom field (Review ETA),Custom field (Revision),Custom field (Root Cause),Custom field (Root Cause Analysis),Custom field (SI No),Satisfaction rating,Custom field (Satisfaction date),Custom field (Scrum Team),Custom field (Sentiment),Custom field (Sequence of Execution - Before Liquibase / After Liquibase),Custom field (Service Now Link),Custom field (ServiceNow #),Custom field (Severity),Custom field (Size),Custom field (Smart Checklist Progress),Custom field (Source),Custom field (Source Query),Sprint,Sprint,Sprint,Custom field (Start Time),Custom field (Start date),Custom field (Status Detail),Custom field (Story Points),Custom field (Story point estimate),Custom field (Strategic Alignment),Custom field (Submitted forms),Custom field (T-shirt size),Custom field (Target Date to Complete Analyzed Stage),Custom field (Target Date to Complete Benefits Realization),Custom field (Target Date to Complete Implementation),Custom field (Target Date to Complete Planned Stage),Custom field (Target Date to Complete Reviewed Stage),Custom field (Target Fix Date),Custom field (Target Query),Custom field (Target Release Date),Custom field (Target end),Custom field (Target start),Custom field (Team),Custom field (Team/Work),Custom field (Test Case Complexity),Custom field (Test Case Type),Custom field (Test Type),Custom field (Testing Impact),Custom field (Theme),Custom field (Through Date),Custom field (Time on Hold),Custom field (Time to approve normal change),Custom field (Time to close after resolution),Custom field (Time to first response),Custom field (Time to resolution),Custom field (Time to workaround),Custom field (Total Impact Hours),Custom field (Total forms),Custom field (Total workaround time),Custom field (Triage Team),Custom field (Underwriting Rules Configurations),Custom field (Urgency),Custom field (Validation SQL for Standalone Scripts),Custom field (Value Area),Custom field (Value Stream),Custom field (Value Stream Lead),Custom field (Vendor Base Delivery Option),Custom field (Vendor Base Version),Custom field (Vendor Fix ID),Custom field (Vendor Name),Custom field (Vendor Target Fix Date),Custom field (Vulnerability),Custom field (Vulnerability Code),Custom field (WAS Changes - Yes/No),Custom field (WSJF),Custom field (Weighted Score),Custom field (Why),Custom field (Work Category),Custom field (Work Effort EST),Custom field (Work Started),Custom field ([CHART] Date of First Response),Custom field ([CHART] Time in Status),Comment,Comment,Comment,Comment,Comment,Comment,Comment,Comment,Comment,Comment,Comment,Comment,Comment,Comment,Comment,Comment,Comment,Comment,Parent,Parent summary,Status Category,Status Category Changed
[LN Police Reports] Administration Screen Header Label Fix,SRNGR-1117,1352537,Story,Done,SRNGR,SAFe Mobi Rangers,software,Michael Holian,5b9bf4b47037cf2ba45ce34c,,,Not Set,Done,Francis Eppinger,5bd8e0734b76d050e297026e,Francis Eppinger,5bd8e0734b76d050e297026e,Francis Eppinger,5bd8e0734b76d050e297026e,06/May/25 6:50 AM,16/May/25 1:29 PM,,15/May/25 8:49 AM,,Mobilitas 2025.06.13,,,,,22/May/25 12:00 AM,0,,"As an mCAS user, I want to see LN Offical Police Report screens with appropriate verbiage on the header labels, so that there is consistency across the application and clear identification of the screen I am on.",,Ingrid Clark,Ju Kerr,610d786ce6e6f800712bb58c,5fa0695b8c4efd006f34fbeb,,0,,,63900,0,17100,,,,,,,,,MOB-122414,,,,,MOB-122191,,,,,,,,,,,,,,,,,,,06/May/25 7:08 AM;Francis.Eppinger;image-20250506-140507.png;https://csaaig.atlassian.net/rest/api/3/attachment/content/580250,06/May/25 7:08 AM;Francis.Eppinger;image-20250506-140549.png;https://csaaig.atlassian.net/rest/api/3/attachment/content/580249,,,,,,,,,,"*AC01*
GIVEN I am an mCAS user with appropriate permissions
WHEN I navigate to the Administration → LN Official Report Access scrren
AND I click the Mobilitas Insurance Group on the table
THEN I am directed to the Mobilitas Insurance Group specific screen for LN Official Report Access
AND the screen header label will be the same verbiage as the Group “field” on the screen

----

+*Existing Issue*+

Navigate to Administration → LN Official Report Access screen.  Then select the Mobilitas Insurance Group link / entry on the table.

!image-20250506-140507.png|width=1290,height=868,alt=""image-20250506-140507.png""!

Individial Screen for Mobilitias Insurance Group has “null” as the screen’s header label text

!image-20250506-140549.png|width=1182,height=652,alt=""image-20250506-140549.png""!

----

Notes:

* This is not critical to the May 2025 release and go-live for Lexis Nexis.  It will be addressed as part of the June 2025 release as a fast follow.  This story will rectify issue raised as part of [https://csaaig.atlassian.net/browse/MOB-122191|https://csaaig.atlassian.net/browse/MOB-122191|smart-link] ",,,,,,,,,,,,,,,,,,,,,com.atlassian.servicedesk.plugins.approvals.internal.customfield.ApprovalsCFValue@33a372df,,,,,,,,,,,,,,,,,,,,,,,,,,,,,,,,,,,,,,,,,,,,,,,,,,,,,,"{repository={count=2, dataType=repository}, json={""cachedValue"":{""errors"":[],""summary"":{""repository"":{""overall"":{""count"":2,""lastUpdated"":""2025-05-14T15:16:08.000-0700"",""dataType"":""repository""},""byInstanceType"":{""stash"":{""count"":2,""name"":""Bitbucket Server""},""oAuth-KYxIRTgn0xInIeZTwGe0AK4HBbDqdF6a"":{""count"":2,""name"":""Bitbucket""}}}}},""isStale"":true}}",True,,,,,,,CCE-42,2025 PI2 Commercial Claims Business Enablement and Partnership Support,,,,,,,,,,,,"Enter the following information in the Description
Logs Reference :
Time when issue occurred :
Is it Intermittent Issue :
POCs to reach out if not the requestor for any additional information:
Any Triage Summary if already done with Dev Team :","Logs Reference :
Time when issue occurred :
Is it Intermittent Issue :
POCs to reach out if not the requestor for any additional information:
Any Triage Summary if already done with Dev Team :",,,,,,,,,,,,,,,,,,,,,,,,,,,,,,,,,,,,,,,,,,,,,,,,,,,,,,,,No,,,,,,,,,,,,,,,0|i2gb81:,,,,,,,,,,,,,,,,,,,,,,,,,,,,,,,,,,,Mobi Rangers 2025.PI2.1,,,,,,3.0,,,,,,,,,,,,,,,,,,,,,,,,,,,,,,,,,,,,,,,,,,,,,,,,,,,,,2025-05-16 20:13:01.435,11900_*:*_1_*:*_0_*|*_10000_*:*_1_*:*_165189442_*|*_12800_*:*_1_*:*_540590795,06/May/25 1:54 PM;5bd8e0734b76d050e297026e;Reviewed during refinement / PI Planning prep.  Added 3 story points.  There is some research that Dev will need to do for identifying where the fix is needed.,14/May/25 1:57 PM;5bd8e0734b76d050e297026e;Updated AC based upon feedback from Nitin following his analysis.  Screen header label will now look to be the same as the Group name on the screen.  The accelerator code “as-is” was referring to the State field which we are not capturing a value for with current set up and approach.,"16/May/25 1:13 PM;5fa0695b8c4efd006f34fbeb;{color:#ff5630}***Update 13:27PM/AZ - Reverted Epic update until* {color}[~accountid:5fecf6448332a1010eac1aec]{color:#ff5630} *can review all for closure.  For now, team has been advised to continue with charging LN/ESIO. ***{color}



Updated Parent Epic from [https://csaaig.atlassian.net/browse/CCE-42|https://csaaig.atlassian.net/browse/CCE-42|smart-link] to [https://csaaig.atlassian.net/browse/CCE-7|https://csaaig.atlassian.net/browse/CCE-7|smart-link] per Vai.  Team has been advised to charge ESIO Project code for this work for LN. 



cc: [~accountid:557058:46349b42-f36b-475e-b587-b1ce19463e68], [~accountid:5bda103da6ec23204d6bf795] , [~accountid:604a35690b784000693c94c6] ",,,,,,,,,,,,,,,,1306749,2025 PI2 Commercial Claims Business Enablement and Partnership Support,Done,15/May/25 8:49 AM
[CXOne Phase 1] -  ClaimCenter New Custom App Events(mCAS UI - New FNOL Wizard ClaimCreate Trigger),SRNGR-1106,1349902,Story,Done,SRNGR,SAFe Mobi Rangers,software,Michael Holian,5b9bf4b47037cf2ba45ce34c,,,Not Set,Done,Francis Eppinger,5bd8e0734b76d050e297026e,Francis Eppinger,5bd8e0734b76d050e297026e,Francis Eppinger,5bd8e0734b76d050e297026e,02/May/25 1:54 PM,23/May/25 9:57 AM,,23/May/25 9:57 AM,,Mobilitas 2025.06.13,,,,,,0,,"As the mCAS system, I want to be able to send a custom app event that includes claim details and a customer’s texting preferences when updates are made to mCAS, so that a customer’s text messaging preferences for a claim can be sent to downstream consumers for enterprise alignment and proper communication channel enablement.",,,,,,,0,,,74700,0,78300,,,,,,SRNGR-711,,,,,,,,,,,,,,,,,,,,,,,,,,,,,,,,,,,,,,"*AC01 - Custom Event To Include SMS Preferences on new mCAS claim*
GIVEN there is a new mCAS claim being created via the FNOL New Claim Wizard
WHEN the FNOL New Claim Wizard is complete and new claim created 
THEN the custom App event is triggered
AND the event will include a customer’s SMS Preference are part of the details in the payload, when applicable for a Person contact type

*QA will need to test and confirm the custom app event is triggered and payload produced.  A few scenarios (e.g. Different Product Type, TPA) can be covered for the claim creation via FNOL Wizard, but not every single scenario need be addressed.  The verificaiton of all data present in the payload does not need to be included as part of this story either, and can be addressed in event code creations or E2E testing.

----

Notes:

* This story was split off from [https://csaaig.atlassian.net/browse/SRNGR-711|https://csaaig.atlassian.net/browse/SRNGR-711|smart-link] to focus on event following new claim creation via the FNOL wizard in mCAS.",,,,,,,,,,,,,,,,,,,,,com.atlassian.servicedesk.plugins.approvals.internal.customfield.ApprovalsCFValue@115b210f,,,,,,,,,,,,,,,,,,,,,,,,,,,,,,,,,,,,,,,,,,,,,,,,,,,,,,{},True,,,,,,,CCE-53,Enable CXOne Platform for Commercial Claims (Integration),,,,,,,,,,,,"Enter the following information in the Description
Logs Reference :
Time when issue occurred :
Is it Intermittent Issue :
POCs to reach out if not the requestor for any additional information:
Any Triage Summary if already done with Dev Team :","Logs Reference :
Time when issue occurred :
Is it Intermittent Issue :
POCs to reach out if not the requestor for any additional information:
Any Triage Summary if already done with Dev Team :",,,,,,,,,,,,,,,,,,,,,,,,,,,,,,,,,,,,,,,,,,,,,,,,,,,,,,,,No,,,,,,,,,,,,,,,0|i2gb9t:,,,,,,,,,,,,,,,,,,,,,,,,,,,,,,,,,,,Mobi Rangers 2025.PI2.1,,,,,,2.0,,,,,,,,,,21/May/25 12:00 AM,,,,,,,,,,,,,,,,,,,,,,,,,,,,,,,,,,,,,,,,,,,2025-05-13 18:29:07.208,11900_*:*_1_*:*_0_*|*_10000_*:*_1_*:*_163896086_*|*_12800_*:*_1_*:*_860916209,13/May/25 11:29 AM;5fa0695b8c4efd006f34fbeb;“{{PersonSMSOptInUpdate_Ext}}” was developed in prior story [https://csaaig.atlassian.net/browse/SRNGR-711|https://csaaig.atlassian.net/browse/SRNGR-711|smart-link] ,"23/May/25 7:45 AM;5bd8e0734b76d050e297026e;[~accountid:712020:5a7914af-cbb8-4226-a8c7-a95afb49230c] [~accountid:603910a72de69b006a321cde] [~accountid:61b794d1acc926006aeab17d]  During SC [~accountid:712020:ae1306a3-d30e-4a6a-920e-45a80d9ddde4] shared with me that Test Case #3 executed is resulting in claim create as well as contact create / update triggeirng the custom app event multiple times following the claim creation from FNOL Wizard.  It appears unnecessary duplicative separate events are triggering the custom app events to send the same information downstream to consumer multiple times.  Will this be addressed in later sprints as we handled additional event work in stories SRNGR 1093, 1096, 1097 & 1098?","23/May/25 8:12 AM;712020:5a7914af-cbb8-4226-a8c7-a95afb49230c;[~accountid:5bd8e0734b76d050e297026e] That is correct, We are doing clean up as we gained much clearer insight over the discussions with CCM , business and Arc. I had informed the same to QA in yesterday’s call.",,,,,,,,,,,,,,,,1312514,Enable CXOne Platform for Commercial Claims (Integration),Done,23/May/25 9:57 AM
[CXOne Phase 1] - Postman Collection & Mapping Updates for Contact Update API for SMS Preferences,SRNGR-1011,1347144,Story,Done,SRNGR,SAFe Mobi Rangers,software,Michael Holian,5b9bf4b47037cf2ba45ce34c,,,Not Set,Done,Francis Eppinger,5bd8e0734b76d050e297026e,Shangeerthana G V,712020:735a265d-e9ce-442b-be82-60e6d4796922,Shangeerthana G V,712020:735a265d-e9ce-442b-be82-60e6d4796922,30/Apr/25 11:02 AM,13/May/25 11:07 AM,,13/May/25 11:07 AM,,Mobilitas 2025.06.13,,,,,,0,,"As an Team MobiRangers, we want a Postman Collection to be available for the Contact Update API with a customer’s SMS Text Preferences, so that we may prepare and test for inbound updates into mCAS for a customer’s texting preference response.

Details:

* Contact Update API has the customer’s SMS Text Preferences included
* Postman Collection for Contact Update API is available for updating customer’s SMS Text Preferences in mCAS",,,,,,,0,,,72900,0,58500,,,SRNGR-712,SRNGR-713,,,,,,,,,,SRNGR-713,,,,,,,,,,,,,,,,,,,08/May/25 10:38 AM;ug:6ef16a5b-ae89-468f-89e2-1fa152021cb6;Claim API - ClaimContactUpdate API.postman_collection.json;https://csaaig.atlassian.net/rest/api/3/attachment/content/580793,12/May/25 10:54 AM;ug:6ef16a5b-ae89-468f-89e2-1fa152021cb6;ClaimPublicIDPrint.gsp;https://csaaig.atlassian.net/rest/api/3/attachment/content/581239,30/Apr/25 11:02 AM;712020:735a265d-e9ce-442b-be82-60e6d4796922;SRNGR-712.docx;https://csaaig.atlassian.net/rest/api/3/attachment/content/579521,,,,,,,,,"*AC01 - Ability To Consume Yes Response From Customer For Their Opt-in To SMS Texting Preference (Opt-In Confirmation)*
GIVEN there is a Person contact on an mCAS claim with SMS Texting Preference Fields Available
WHEN a Customer responds Yes for Opt-In To SMS Texting
AND CCM (API HUB team) will call the Claim API (patchclaimContact) 
THEN the Opt-in To SMS Texting for the Home Phone Number value is updated to Yes
AND/OR the Opt-in To SMS Texting for the Mobilt Phone Number is updated to Yes

*AC02 - Ability To Consume No Response From Customer For Their Opt-in To SMS Texting Preference (Opt-Out Confirmation)*
GIVEN there is a Person contact on an mCAS claim with SMS Texting Preference Fields Available
WHEN a Customer responds No for Opt-In To SMS Texting
AND CCM (API HUB team) will call the Claim API (patchclaimContact) 
THEN the Opt-in To SMS Texting for the Home Phone Number value is updated to No
AND/OR the Opt-in To SMS Texting for the Mobilt Phone Number is updated to No

Scenarios:

# Existing Pending → Yes Update
# Existing Pending → No Update
# Existing Yes → No Update
# Existing No → Yes Update

Note:  This API will not check about the existing value set on Opt-in To SMS Texting field to set the value to “Yes” (instead the Pending value from CC is sent and return/set the value “Yes” which is passed on the Payload from CCM)",,,,,,,,,,,,,,,,,,,,,com.atlassian.servicedesk.plugins.approvals.internal.customfield.ApprovalsCFValue@358d4abd,,,,,,,,,,,,,,No UAT,,,,,,,,,,,,,,,,,,,,,,,,,,,,,,,,,,,,,,,,"{repository={count=3, dataType=repository}, json={""cachedValue"":{""errors"":[],""summary"":{""repository"":{""overall"":{""count"":3,""lastUpdated"":""2025-05-08T15:59:01.000-0700"",""dataType"":""repository""},""byInstanceType"":{""stash"":{""count"":3,""name"":""Bitbucket Server""},""oAuth-KYxIRTgn0xInIeZTwGe0AK4HBbDqdF6a"":{""count"":3,""name"":""Bitbucket""}}}}},""isStale"":true}}",True,,,,,,,CCE-34,Enable CXOne Platform for Commercial Claims - Preference Mgmt/ Trigger,,,,,,,,,,,,"Enter the following information in the Description
Logs Reference :
Time when issue occurred :
Is it Intermittent Issue :
POCs to reach out if not the requestor for any additional information:
Any Triage Summary if already done with Dev Team :","Logs Reference :
Time when issue occurred :
Is it Intermittent Issue :
POCs to reach out if not the requestor for any additional information:
Any Triage Summary if already done with Dev Team :",,,,,,,,,,,,,,,,,,,,,,,,,,,,,,,,,,,,,,,,,,,,,,,,,,,,,,,,No,,,,,,,,,,,,,,,0|i5nm1z:,,,,,,,,,,,,,,,,,,,,,,,,,,,,,,,,,,,Mobi Rangers 2025.PI1.7 I&P,,,,,,3.0,,,,,,,,,,,,,,,,,,,,,,,,,,,,,,,,,,,,,,,,,,,,,,,,,,,,,2025-04-30 18:02:37.908,11900_*:*_1_*:*_0_*|*_10000_*:*_1_*:*_2203_*|*_12800_*:*_1_*:*_702918247,"30/Apr/25 11:02 AM;5bd8e0734b76d050e297026e;Removing below AC based upon repurposing of story and aligning with necessary scope of stories.

*AC01 - App Event For Opt-in To SMS Texting field value = No*
GIVEN there is a Person contact on a non-TPA mCAS claim with SMS Texting Preference Fields Available
AND an No response for Opt-In To SMS Texting Is Received in mCAS
WHEN the Opt-in To SMS Texting for the Home Phone Number value is updated to No
AND/OR the Opt-in To SMS Texting for the Mobilt Phone Number is updated to No
THEN an App Event is generated by the system to include the Customer, Phone Number & SMS Preferences for consuming application(s)

This would be triggered by mCAS consuming an update from through customer’s SMS preference response / confirmaiton to Opt-Opt",30/Apr/25 11:02 AM;603910a72de69b006a321cde;The analysis  and the document has been completed and attached in this story card. please see [https://csaaig.atlassian.net/browse/SRNGR-712|https://csaaig.atlassian.net/browse/SRNGR-712|smart-link].docs. We have extended the Claim API to consume the extra custom fields which are going to be consume by the CCM.,"30/Apr/25 11:08 AM;712020:735a265d-e9ce-442b-be82-60e6d4796922;4/30: Work with APIHub team to get it tested. 

Nate will update it by Friday. Separate task may need to be created depends on the update from them.

[~accountid:5bd8e0734b76d050e297026e] ",06/May/25 8:50 AM;5bd8e0734b76d050e297026e;This story will address the original scope of [https://csaaig.atlassian.net/browse/SRNGR-713|https://csaaig.atlassian.net/browse/SRNGR-713|smart-link].  Merged [https://csaaig.atlassian.net/browse/SRNGR-713|https://csaaig.atlassian.net/browse/SRNGR-713|smart-link] AC into this story’s AC.,,,,,,,,,,,,,,,1304088,Enable CXOne Platform for Commercial Claims - Preference Mgmt/ Trigger,Done,13/May/25 11:07 AM
